id,ignore,catalog,title,description,Theme,keywords_list,version,doi,layer_unit,contact_name,contact_email,providers_list,license,constellation_list,platform,instruments_list,gsd,start_date,end_date,date_step,date_offset,date_unit,date_style,ignore_29feb,depth_list,sld_url,qml_url,main_url,url_1,url_2,url_3,url_4,url_5,url_6,url_7,url_8,url_9,url_10,url_11,url_12,url_13,url_14,url_15,url_16,url_17,url_18,url_19,url_20,url_21,url_22,url_23,url_24
wv_mcd19a2v061.seasconv.m_std,0,openlandmap,MCD19A2 long-term water vapor (std. dev.),"The monthly aggregated water vapor dataset is derived from MCD19A2 v061, measuring the column above ground retrieved from MODIS near-IR bands at 0.94μm. The dataset time spans from 2000 to 2022 and provides data that covers the entire globe. The monthly aggregation considered the mean and standard deviation of daily water vapor time-series data. Only positive non-cloudy pixels were considered valid observations to derive the mean and the standard deviation. The remaining no-data values were filled using the TMWM algorithm. This dataset also includes smoothed mean and standard deviation values using the Whittaker method. The quality assessment layers and the number of valid observations for each month can provide an indication of the reliability of the monthly mean and standard deviation values.",Climate,"water,modis,mcd19a2",v20230619,https://doi.org/10.5281/zenodo.8226283,10^-3cm,Rolf Simões,rolf.simoes@opengeohub.org ,"lp_daac,opengeohub",CC-BY-SA-4.0,,,modis,1000,2000-01-01,2022-12-31,,,static,interval,0,,https://s3.openlandmap.org/arco/wv_mcd19a2v061_std.sld,https://s3.openlandmap.org/arco/wv_mcd19a2v061_std.qml,https://s3.openlandmap.org/arco/wv_mcd19a2v061.seasconv.m.m01_sd_1km_s_{dt}_go_epsg.4326_v20230619.tif,https://s3.openlandmap.org/arco/wv_mcd19a2v061.seasconv.m.m02_sd_1km_s_{dt}_go_epsg.4326_v20230619.tif,https://s3.openlandmap.org/arco/wv_mcd19a2v061.seasconv.m.m03_sd_1km_s_{dt}_go_epsg.4326_v20230619.tif,https://s3.openlandmap.org/arco/wv_mcd19a2v061.seasconv.m.m04_sd_1km_s_{dt}_go_epsg.4326_v20230619.tif,https://s3.openlandmap.org/arco/wv_mcd19a2v061.seasconv.m.m05_sd_1km_s_{dt}_go_epsg.4326_v20230619.tif,https://s3.openlandmap.org/arco/wv_mcd19a2v061.seasconv.m.m06_sd_1km_s_{dt}_go_epsg.4326_v20230619.tif,https://s3.openlandmap.org/arco/wv_mcd19a2v061.seasconv.m.m07_sd_1km_s_{dt}_go_epsg.4326_v20230619.tif,https://s3.openlandmap.org/arco/wv_mcd19a2v061.seasconv.m.m08_sd_1km_s_{dt}_go_epsg.4326_v20230619.tif,https://s3.openlandmap.org/arco/wv_mcd19a2v061.seasconv.m.m09_sd_1km_s_{dt}_go_epsg.4326_v20230619.tif,https://s3.openlandmap.org/arco/wv_mcd19a2v061.seasconv.m.m10_sd_1km_s_{dt}_go_epsg.4326_v20230619.tif,https://s3.openlandmap.org/arco/wv_mcd19a2v061.seasconv.m.m11_sd_1km_s_{dt}_go_epsg.4326_v20230619.tif,https://s3.openlandmap.org/arco/wv_mcd19a2v061.seasconv.m.m12_sd_1km_s_{dt}_go_epsg.4326_v20230619.tif,,,,,,,,,,,,,
wv_mcd19a2v061.seasconv.m.yearly,0,openlandmap,MCD19A2 annual water vapor,"The monthly aggregated water vapor dataset is derived from MCD19A2 v061, measuring the column above ground retrieved from MODIS near-IR bands at 0.94μm. The dataset time spans from 2000 to 2022 and provides data that covers the entire globe. The monthly aggregation considered the mean and standard deviation of daily water vapor time-series data. Only positive non-cloudy pixels were considered valid observations to derive the mean and the standard deviation. The remaining no-data values were filled using the TMWM algorithm. This dataset is specifically derived from monthly time-series, providing a yearly time-series aggregated statistics of the monthly time-series data.",Climate,"water,modis,mcd19a2",v20230619,https://doi.org/10.5281/zenodo.8226282,10^-3cm,Rolf Simões,rolf.simoes@opengeohub.org ,"lp_daac,opengeohub",CC-BY-SA-4.0,,,modis,1000,2000-01-01,2022-12-31,1,,years,interval,0,,https://s3.openlandmap.org/arco/wv_mcd19a2v061.sld,https://s3.openlandmap.org/arco/wv_mcd19a2v061.qml,https://s3.openlandmap.org/arco/wv_mcd19a2v061.seasconv.m.yearly_p50_1km_s_{dt}_go_epsg.4326_v20230619.tif,https://s3.openlandmap.org/arco/wv_mcd19a2v061.seasconv.m.yearly_p25_1km_s_{dt}_go_epsg.4326_v20230619.tif,https://s3.openlandmap.org/arco/wv_mcd19a2v061.seasconv.m.yearly_p75_1km_s_{dt}_go_epsg.4326_v20230619.tif,https://s3.openlandmap.org/arco/wv_mcd19a2v061.seasconv.m.yearly_sd_1km_s_{dt}_go_epsg.4326_v20230619.tif,https://s3.openlandmap.org/arco/wv_mcd19a2v061.seasconv.sd.yearly_p50_1km_s_{dt}_go_epsg.4326_v20230619.tif,https://s3.openlandmap.org/arco/wv_mcd19a2v061.seasconv.sd.yearly_p25_1km_s_{dt}_go_epsg.4326_v20230619.tif,https://s3.openlandmap.org/arco/wv_mcd19a2v061.seasconv.sd.yearly_p75_1km_s_{dt}_go_epsg.4326_v20230619.tif,https://s3.openlandmap.org/arco/wv_mcd19a2v061.seasconv.sd.yearly_sd_1km_s_{dt}_go_epsg.4326_v20230619.tif,,,,,,,,,,,,,,,,,
bulkdens.fineearth_usda.4a1h,0,openlandmap,Long-term soil bulk density for fine earth,"Soil bulk density (fine earth) 10 x kg / m-cubic at 6 standard depths (0, 10, 30, 60, 100 and 200 cm) at 250 m resolution",Geology and Soils,"soil carbon,bulk density",v0,https://doi.org/10.5281/zenodo.2525665,10 x kg / m-cubic,Tom Hengl,tom.hengl@opengeohub.org,opengeohub,CC-BY-SA-4.0,,,,250,1950-01-01,2017-12-31,,,static,interval,0,"b0cm,b10cm,b30cm,b60cm,b100cm,b200cm",https://s3.openlandmap.org/arco/bulkdens.fineearth_usda.4a1h_m.sld,https://s3.openlandmap.org/arco/bulkdens.fineearth_usda.4a1h_m.qml,https://s3.openlandmap.org/arco/bulkdens.fineearth_usda.4a1h_m_250m_{dp}_{dt}_go_epsg.4326_v0.2.tif,,,,,,,,,,,,,,,,,,,,,,,,
geom_merit.dem,0,openlandmap,MERIT geomorphometry,"Relief parameters were derived derived using SAGA GIS (http://www.saga-gis.org/) and the MERIT DEM (Yamazaki et al. 2017) projected in the Equi7 grid system (Bauer-Marschallinger et al. 2014). Once derived, DEM derivatives were then reprojected to the lon-lat system.",Geology and Soils,"meritdem,geomorphometry",v1,https://doi.org/10.1038/s41597-020-0479-6,meter,Tom Hengl,tom.hengl@opengeohub.org,"yamazaki_lab,opengeohub",CC-BY-4.0,,,,250,2017-01-01,2018-12-31,,,static,interval,0,,https://s3.openlandmap.org/arco/slope_merit.dem.sld,https://s3.openlandmap.org/arco/slope_merit.dem.qml,https://s3.openlandmap.org/arco/geom_merit.dem_m_250m_s_{dt}_go_epsg.4326_v1.0.tif,https://s3.openlandmap.org/arco/dev-magnitude_merit.dem_m_5km_s_{dt}_go_epsg.4326_v1.0.tif,https://s3.openlandmap.org/arco/cti_merit.dem_m_5km_s_{dt}_go_epsg.4326_v1.0.tif,https://s3.openlandmap.org/arco/rough-scale_merit.dem_m_5km_s_{dt}_go_epsg.4326_v1.0.tif,https://s3.openlandmap.org/arco/vbf_merit.dem_m_5km_s_{dt}_go_epsg.4326_v1.0.tif,https://s3.openlandmap.org/arco/slope_merit.dem_m_250m_s_{dt}_go_epsg.4326_v1.0.tif,,,,,,,,,,,,,,,,,,,
fapar_proba.v,0,openlandmap,PROBA-V long-term fraction of absorbed photosynthetically active radiation (FAPAR),"Fraction of absorbed photosynthetically active radiation monthly images for 2014–2017 were obtained from https://land.copernicus.eu (original values reported in the range 0–235 with scaling factor 1/255, i.e., with a maximum value of 0.94). From a total of 142 images downloaded from https://land.copernicus.eu we derived minimum, median and maximum value of FAPAR per month (12) using the 95% probability interval using the data.table package (http://r-datatable.com).",Orthoimagery,"fapar,land potential,natural vegetation",v1,https://doi.org/10.5281/zenodo.3459830,index,Tom Hengl,tom.hengl@opengeohub.org,"copernicus,opengeohub",CC-BY-SA-4.0,,proba-v,vgt,250,2014-01-01,2017-12-31,,,static,interval,0,,https://s3.openlandmap.org/arco/fapar_proba.v.sld,https://s3.openlandmap.org/arco/fapar_proba.v.qml,https://s3.openlandmap.org/arco/fapar_proba.v.annual_d_250m_s_{dt}_go_epsg.4326_v1.0.tif,https://s3.openlandmap.org/arco/fapar_proba.v.jan_d_250m_s_{dt}_go_epsg.4326_v1.0.tif,https://s3.openlandmap.org/arco/fapar_proba.v.feb_d_250m_s_{dt}_go_epsg.4326_v1.0.tif,https://s3.openlandmap.org/arco/fapar_proba.v.mar_d_250m_s_{dt}_go_epsg.4326_v1.0.tif,https://s3.openlandmap.org/arco/fapar_proba.v.apr_d_250m_s_{dt}_go_epsg.4326_v1.0.tif,https://s3.openlandmap.org/arco/fapar_proba.v.may_d_250m_s_{dt}_go_epsg.4326_v1.0.tif,https://s3.openlandmap.org/arco/fapar_proba.v.jun_d_250m_s_{dt}_go_epsg.4326_v1.0.tif,https://s3.openlandmap.org/arco/fapar_proba.v.jul_d_250m_s_{dt}_go_epsg.4326_v1.0.tif,https://s3.openlandmap.org/arco/fapar_proba.v.aug_d_250m_s_{dt}_go_epsg.4326_v1.0.tif,https://s3.openlandmap.org/arco/fapar_proba.v.sep_d_250m_s_{dt}_go_epsg.4326_v1.0.tif,https://s3.openlandmap.org/arco/fapar_proba.v.oct_d_250m_s_{dt}_go_epsg.4326_v1.0.tif,https://s3.openlandmap.org/arco/fapar_proba.v.nov_d_250m_s_{dt}_go_epsg.4326_v1.0.tif,https://s3.openlandmap.org/arco/fapar_proba.v.dec_d_250m_s_{dt}_go_epsg.4326_v1.0.tif,,,,,,,,,,,,
forest.cover_esacci.ifl,0,openlandmap,Tree-covered and intact forest landscapes,"Based on the UNEP historic forest cover map, ESA land cover time series and intact forest landscape (IFL 2000, 2013 and 2016) data (Potapov et al. 2013).",Land Cover and Land Use,"tree cover,forest",v0,https://doi.org/10.5281/zenodo.1477073,class,Tom Hengl,tom.hengl@opengeohub.org,"esa_cci,opengeohub",CC-BY-SA-4.0,,,,250,1995-01-01,2016-12-31,1,"4,4,4,2,2",years,interval,0,,https://s3.openlandmap.org/arco/forest.cover_esacci.sld,https://s3.openlandmap.org/arco/forest.cover_esacci.qml,https://s3.openlandmap.org/arco/forest.cover_esacci.ifl_c_250m_s_{dt}_go_epsg.4326_v0.1.tif,,,,,,,,,,,,,,,,,,,,,,,,
grtgroup_usda.soiltax,0,openlandmap,USDA long-term soil great groups,"Distribution of the USDA soil great groups based on machine learning predictions from global compilation of soil profiles (>350,000 training points).",Geology and Soils,"soil type,usda soil taxonomy",v0,https://doi.org/10.5281/zenodo.3528062,class,Tom Hengl,tom.hengl@opengeohub.org,opengeohub,CC-BY-SA-4.0,,,,250,1950-01-01,2017-12-31,,,static,interval,0,,https://s3.openlandmap.org/arco/grtgroup_usda.soiltax_c.sld,https://s3.openlandmap.org/arco/grtgroup_usda.solitax_c.qml,https://s3.openlandmap.org/arco/grtgroup_usda.soiltax_c_250m_s_{dt}_go_espg.4326_v0.2.tif,,,,,,,,,,,,,,,,,,,,,,,,
land.cover_copernicus,0,openlandmap,Copernicus PROBA-V annual land cover,"Annual, global 100m land cover maps in 2015, 2016, 2017, 2018, 2019, produced by the global component of the Copernicus Land Service, derived from PROBA-V satellite observations and ancillary datasets",Land Cover and Land Use,"land cover,land use,globe,earth,remote sensing,satellite,copernicus,proba-v",v3,https://doi.org/10.5281/zenodo.4723924,class,Marcel Buchhorn,marcel.buchhorn@vito.be,"copernicus,opengeohub",CC-BY-4.0,,,,100,2015-01-01,2019-12-31,1,,years,interval,0,,https://s3.openlandmap.org/arco/land.cover_copernicus.sld,https://s3.openlandmap.org/arco/land.cover_copernicus.qml,https://s3.openlandmap.org/arco/land.cover_copernicus_c_100m_s_{dt}_go_epsg.4326_v3.0.1.tif,,,,,,,,,,,,,,,,,,,,,,,,
organic.carbon.stock_msa.kgm2,0,openlandmap,OpenLandMap long-term soil organic carbon stock,"Soil organic carbon stock in kg/m2 for 5 standard depth intervals (0–10, 10–30, 30–60, 60–100 and 100–200 cm) at 250 m resolution. To convert to t/ha multiply by 10. Derived using soil organic carbon content (https://doi.org/10.5281/zenodo.1475457), bulk density (https://doi.org/10.5281/zenodo.1475970) and coarse fragments (https://doi.org/10.5281/zenodo.2525681), predicted from point data at 6 standard depths. Depth to bed rock has been ignored, hence total stocks might be about 10–15% lower then reported.",Geology and Soils,soil carbon,v0,https://doi.org/10.5281/zenodo.2536040,kg / m2,Tom Hengl,tom.hengl@opengeohub.org,opengeohub,CC-BY-SA-4.0,,,,250,1950-01-01,2017-12-31,,,static,interval,0,"b0t10cm,b0t30cm,b10t30cm,b30t60cm,b60t100cm,b100t200cm",https://s3.openlandmap.org/arco/organic.carbon.stock_msa.kgm2_m.sld,https://s3.openlandmap.org/arco/organic.carbon.stock_msa.kgm2_m.qml,https://s3.openlandmap.org/arco/organic.carbon.stock_msa.kgm2_m_250m_{dp}_{dt}_go_epsg.4326_v0.2.tif,https://s3.openlandmap.org/arco/organic.carbon.stock_msa.kgm2_td_250m_{dp}_{dt}_go_epsg.4326_v0.2.tif,,,,,,,,,,,,,,,,,,,,,,,
organic.carbon_usda.6a1c,0,openlandmap,OpenLandMap long-term soil organic carbon content,"Soil organic carbon content in x 5 g / kg (to convert to % divide by 2) at 6 standard depths (0, 10, 30, 60, 100 and 200 cm) at 250 m resolution.Predicted from a global compilation of soil points. Also available for download: soil organic stock maps in in kg / m2 (https://doi.org/10.5281/zenodo.1475453) and bulk density maps in kg / m3 (https://doi.org/10.5281/zenodo.1475970).",Geology and Soils,soil carbon,v0,https://doi.org/10.5281/zenodo.2525553,x5 g/kg,Tom Hengl,tom.hengl@opengeohub.org,opengeohub,CC-BY-SA-4.0,,,,250,1950-01-01,2017-12-31,,,static,interval,0,"b0cm,b10cm,b30cm,b60cm,b100cm,b200cm",https://s3.openlandmap.org/arco/organic.carbon_usda.6a1c_m.sld,https://s3.openlandmap.org/arco/organic.carbon_usda.6a1c_m.qml,https://s3.openlandmap.org/arco/organic.carbon_usda.6a1c_m_250m_{dp}_{dt}_go_epsg.4326_v0.2.tif,,,,,,,,,,,,,,,,,,,,,,,,
pft.landcover_esa.cci.lc,0,openlandmap,ESA CCI annual plant functional types (PFT),"This dataset contains Global Plant Functional Types (PFT) data, from the ESA Medium Resolution Land Cover (MRLC) Climate Change Initiative project. The data provides yearly data, and initially covers the time period from 1992 to 2020. It is anticipated that the dataset will be updated annually going forward. The PFT v2.0.8 global dataset has 14 layers, each describing the percentage cover (0-100%) of a plant functional type at a spatial resolution of 300 m: broadleaved evergreen trees, broadleaved deciduous trees, needleleaved evergreen trees, needleleaved deciduous trees, broadleaved evergreen shrubs, broadleaved deciduous shrubs, needleleaved evergreen shrubs, needleleaved deciduous shrubs, natural grasses, herbaceous cropland (i.e., managed grasses), built, water, bare areas, and snow and ice.",Land Cover and Land Use,"land cover,cci,pft",v20230616,https://doi.org/10.5285/26a0f46c95ee4c29b5c650b129aab788,%,ESA CCI Land Cover project,contact@esa-landcover-cci.org,"esa_cci,opengeohub",CC-BY-4.0,,,,300,1992-01-01,2020-12-31,1,,years,interval,0,,https://s3.openlandmap.org/arco/esa.cci.lc_pc.sld,https://s3.openlandmap.org/arco/esa.cci.lc_pc.qml,https://s3.openlandmap.org/arco/pft.grass.man_esa.cci.lc_pc_300m_s_{dt}_go_epsg.4326_v20230616.tif,https://s3.openlandmap.org/arco/pft.built_esa.cci.lc_pc_300m_s_{dt}_go_epsg.4326_v20230616.tif,https://s3.openlandmap.org/arco/pft.bare_esa.cci.lc_pc_300m_s_{dt}_go_epsg.4326_v20230616.tif,https://s3.openlandmap.org/arco/pft.grass.nat_esa.cci.lc_pc_300m_s_{dt}_go_epsg.4326_v20230616.tif,https://s3.openlandmap.org/arco/pft.land_esa.cci.lc_pc_300m_s_{dt}_go_epsg.4326_v20230616.tif,https://s3.openlandmap.org/arco/pft.shrubs.bd_esa.cci.lc_pc_300m_s_{dt}_go_epsg.4326_v20230616.tif,https://s3.openlandmap.org/arco/pft.shrubs.be_esa.cci.lc_pc_300m_s_{dt}_go_epsg.4326_v20230616.tif,https://s3.openlandmap.org/arco/pft.shrubs.nd_esa.cci.lc_pc_300m_s_{dt}_go_epsg.4326_v20230616.tif,https://s3.openlandmap.org/arco/pft.shrubs.ne_esa.cci.lc_pc_300m_s_{dt}_go_epsg.4326_v20230616.tif,https://s3.openlandmap.org/arco/pft.snowice_esa.cci.lc_pc_300m_s_{dt}_go_epsg.4326_v20230616.tif,https://s3.openlandmap.org/arco/pft.trees.bd_esa.cci.lc_pc_300m_s_{dt}_go_epsg.4326_v20230616.tif,https://s3.openlandmap.org/arco/pft.trees.be_esa.cci.lc_pc_300m_s_{dt}_go_epsg.4326_v20230616.tif,https://s3.openlandmap.org/arco/pft.trees.nd_esa.cci.lc_pc_300m_s_{dt}_go_epsg.4326_v20230616.tif,https://s3.openlandmap.org/arco/pft.trees.ne_esa.cci.lc_pc_300m_s_{dt}_go_epsg.4326_v20230616.tif,https://s3.openlandmap.org/arco/pft.water.inland_esa.cci.lc_pc_300m_s_{dt}_go_epsg.4326_v20230616.tif,https://s3.openlandmap.org/arco/pft.water.ocean_esa.cci.lc_pc_300m_s_{dt}_go_epsg.4326_v20230616.tif,https://s3.openlandmap.org/arco/pft.water_esa.cci.lc_pc_300m_s_{dt}_go_epsg.4326_v20230616.tif,,,,,,,,
precipitation_sm2rain.ltm,0,openlandmap,SM2RAIN long-term precipitation,"Monthly precipitation in mm at 1 km resolution based on SM2RAIN-ASCAT 2007-2021 (https://doi.org/10.5281/zenodo.2615278). Downscaled to 1 km resolution using gdalwarp (cubic splines) and combined with WorldClim (https://worldclim.org/data/worldclim21.html) and CHELSA Climate (https://chelsa-climate.org/downloads/) monthly values. Final values are estimated as a simple average between the three precipitation data sources; a more objective approach would be to use training points e.g. meteo-station monthly values, then train an ensemble model using the 3 data sources as independent variables. Another global data source of precipitation images is the monthly IMERGE dataset, however this requires transformation and is available only for limited span of years.",Climate,"precipitation,global,openlandmap",v0,https://doi.org/10.5281/zenodo.6458580,mm,Tom Hengl,tom.hengl@opengeohub.org,"cnr_irpi,opengeohub",CC-BY-SA-4.0,,,,1000,2007-01-01,2018-12-31,,,static,interval,0,,https://s3.openlandmap.org/arco/precipitation_sm2rain.sld,https://s3.openlandmap.org/arco/precipitation_sm2rain.qml,https://s3.openlandmap.org/arco/precipitation_sm2rain.jan_m_1km_s_{dt}_go_epsg.4326_v0.2.tif,https://s3.openlandmap.org/arco/precipitation_sm2rain.feb_m_1km_s_{dt}_go_epsg.4326_v0.2.tif,https://s3.openlandmap.org/arco/precipitation_sm2rain.mar_m_1km_s_{dt}_go_epsg.4326_v0.2.tif,https://s3.openlandmap.org/arco/precipitation_sm2rain.apr_m_1km_s_{dt}_go_epsg.4326_v0.2.tif,https://s3.openlandmap.org/arco/precipitation_sm2rain.may_m_1km_s_{dt}_go_epsg.4326_v0.2.tif,https://s3.openlandmap.org/arco/precipitation_sm2rain.jun_m_1km_s_{dt}_go_epsg.4326_v0.2.tif,https://s3.openlandmap.org/arco/precipitation_sm2rain.jul_m_1km_s_{dt}_go_epsg.4326_v0.2.tif,https://s3.openlandmap.org/arco/precipitation_sm2rain.aug_m_1km_s_{dt}_go_epsg.4326_v0.2.tif,https://s3.openlandmap.org/arco/precipitation_sm2rain.sep_m_1km_s_{dt}_go_epsg.4326_v0.2.tif,https://s3.openlandmap.org/arco/precipitation_sm2rain.oct_m_1km_s_{dt}_go_epsg.4326_v0.2.tif,https://s3.openlandmap.org/arco/precipitation_sm2rain.nov_m_1km_s_{dt}_go_epsg.4326_v0.2.tif,https://s3.openlandmap.org/arco/precipitation_sm2rain.dec_m_1km_s_{dt}_go_epsg.4326_v0.2.tif,,,,,,,,,,,,,
ph.h2o_usda.4c1a2a,0,openlandmap,OpenLandMap long-term soil pH,"Soil pH in H2O at 6 standard depths (0, 10, 30, 60, 100 and 200 cm) at 250 m resolution according to USDA method code: 4C1a2a",Geology and Soils,"soil ph,acidity",v0,https://doi.org/10.5281/zenodo.2525664,ph,Tom Hengl,tom.hengl@opengeohub.org,opengeohub,CC-BY-SA-4.0,,,,250,1950-01-01,2017-12-31,,,static,interval,0,"b0cm,b100cm,b10cm,b200cm,b30cm,b60cm",https://s3.openlandmap.org/arco/ph.h2o_usda.4c1a2a_m.sld,https://s3.openlandmap.org/arco/ph.h2o_usda.4c1a2a_m.qml,https://s3.openlandmap.org/arco/ph.h2o_usda.4c1a2a_m_250m_{dp}_{dt}_go_epsg.4326_v0.2.tif,,,,,,,,,,,,,,,,,,,,,,,,
pop.count_ghs.jrc,0,openlandmap,JRC Global Human Settlement annual population (GHS),"This GHS-POP spatial raster product (GHS-POP_GLOBE_R2023) depicts the distribution of human population, expressed as the number of people per cell. Residential population estimates at 5 years interval between 1975 and 2030 are derived from the raw global census data harmonized by CIESIN for the Gridded Population of the World, version 4.11 (GPWv4.11) at polygon level, and disaggregated from census or administrative units to grid cells, informed by the distribution, classification and volume of built-up as mapped in the GHSL global layers per corresponding epoch. The disaggregation methodology is described in Freire et al., (2016).",Population Distribution,,v20230620,https://doi.org/10.2905/2FF68A52-5B5B-4A22-8F40-C41DA8332CFE,number of people ,Julia Hackländer,julia.hacklaender@opengeohub.org,"jrc,opengeohub",CC-BY-4.0,,,,100,2000-01-01,2021-12-31,1,,years,interval,0,,https://s3.openlandmap.org/arco/pop.count_ghs.jrc.sld,https://s3.openlandmap.org/arco/pop.count_ghs.jrc.qml,https://s3.openlandmap.org/arco/pop.count_ghs.jrc_m_100m_s_{dt}_go_epsg.4326_v20230620.tif,,,,,,,,,,,,,,,,,,,,,,,,
sand.wfraction_usda.3a1a1a,0,openlandmap,OpenLandMap long-term sand content,"Sand content in % (kg / kg) at 6 standard depths (0, 10, 30, 60, 100 and 200 cm) at 250 m resolution. Based on machine learning predictions from global compilation of soil profiles and samples.",Water,"sand fraction,soil texture",v0,https://doi.org/10.5281/zenodo.2525662,% (kg / kg),Tom Hengl,tom.hengl@opengeohub.org,opengeohub,CC-BY-SA-4.0,,,,250,1950-01-01,2017-12-31,,,static,interval,0,"b0cm,b10cm,b60cm,b100cm",https://s3.openlandmap.org/arco/sand.wfraction_usda.3a1a1a_m.sld,https://s3.openlandmap.org/arco/sand.wfraction_usda.3a1a1a_m.qml,https://s3.openlandmap.org/arco/sand.wfraction_usda.3a1a1a_m_250m_{dp}_{dt}_go_epsg.4326_v0.2.tif,,,,,,,,,,,,,,,,,,,,,,,,
lc_mcd12q1v061.p1,0,openlandmap,MCD12Q1 annual land cover and land use,"The yearly land use and land cover dataset is derived from MCD12Q1 v061. This data provides an yearly mosaics of land use and land cover data from 2001 to 2022. This dataset includes layers of land cover type 1 (t1), 2 (t2), and 5 (t5), land cover property 1 (p1) and 2 (p2), land cover property assessment 1 (p1a) and 2 (p2a), and land cover quality control (qc).",Land Cover and Land Use,"modis,land  cover,land use,global,oemc",v20230818,https://doi.org/10.5281/zenodo.8367523,class,Rolf Simões,rolf.simoes@opengeohub.org ,"lp_daac,opengeohub",CC-BY-SA-4.0,,modis,,500,2001-01-01,2021-12-31,1,,years,interval,0,,https://s3.openlandmap.org/arco/mcd12q1v061.p1_c.sld,https://s3.openlandmap.org/arco/mcd12q1v061.p1_c.qml,https://s3.openlandmap.org/arco/lc_mcd12q1v061.p1_c_500m_s_{dt}_go_epsg.4326_v20230818.tif,https://s3.openlandmap.org/arco/lc_mcd12q1v061.p1a_c_500m_s_{dt}_go_epsg.4326_v20230818.tif,https://s3.openlandmap.org/arco/lc_mcd12q1v061.p2_c_500m_s_{dt}_go_epsg.4326_v20230818.tif,https://s3.openlandmap.org/arco/lc_mcd12q1v061.p2a_c_500m_s_{dt}_go_epsg.4326_v20230818.tif,https://s3.openlandmap.org/arco/lc_mcd12q1v061.qc_c_500m_s_{dt}_go_epsg.4326_v20230818.tif,https://s3.openlandmap.org/arco/lc_mcd12q1v061.t1_c_500m_s_{dt}_go_epsg.4326_v20230818.tif,https://s3.openlandmap.org/arco/lc_mcd12q1v061.t2_c_500m_s_{dt}_go_epsg.4326_v20230818.tif,https://s3.openlandmap.org/arco/lc_mcd12q1v061.t5_c_500m_s_{dt}_go_epsg.4326_v20230818.tif,,,,,,,,,,,,,,,,,
texture.class_usda.tt,0,openlandmap,OpenLandMap long-term soil texture classes (USDA system),"Soil texture classes (USDA system) for 6 standard soil depths (0, 10, 30, 60, 100 and 200 cm) at 250 m.",Geology and Soils,"soil texture,usda",v0,https://doi.org/10.5281/zenodo.2525817,class,Tom Hengl,tom.hengl@opengeohub.org,opengeohub,CC-BY-SA-4.0,,,,250,1950-01-01,2017-12-31,,,static,interval,0,"b0cm,b10cm,b30cm,b60cm,,b100cm,b200cm",https://s3.openlandmap.org/arco/texture.class_usda.tt_m.sld,https://s3.openlandmap.org/arco/texture.class_usda.tt_m.qml,https://s3.openlandmap.org/arco/texture.class_usda.tt_m_250m_{dp}_{dt}_go_epsg.4326_v0.2.tif,,,,,,,,,,,,,,,,,,,,,,,,
water.occurrence_jrc.surfacewater,0,openlandmap,JRC long-term surface water occurrence,"Gobal surface water occurrence based on Pekel at al. (2016), and the layer is resampled to spatial resolution 1/480 d.d. (about 250 m) using gdalwarp with ""average"" resampling. Original layers are available at 30 m resolution. The orignal dataset and document: https://doi.org/10.1038/nature20584.",Water,"landsat,tree cover,bare ground",v1,https://doi.org/10.5281/zenodo.1439254,,Tom Hengl,tom.hengl@opengeohub.org,"jrc,opengeohub",CC-BY-SA-4.0,,,,250,1984-01-01,2016-12-31,,,static,interval,0,b0t200cm,https://s3.openlandmap.org/arco/water.occurrance_jrc.surfacewater_p.sld,https://s3.openlandmap.org/arco/water.occurrance_jrc.surfacewater_p.qml,https://s3.openlandmap.org/arco/water.occurrence_jrc.surfacewater_p_250m_{dp}_{dt}_go_epsg.4326_v1.0.tif,,,,,,,,,,,,,,,,,,,,,,,,
watercontent.33kPa_usda.4b1c,0,openlandmap,OpenLandMap long-term soil water content,"Soil water content (volumetric) in percent for 33 kPa and 1500 kPa suctions predicted at 6 standard depths (0, 10, 30, 60, 100 and 200 cm) at 250 m resolution. Training points are based on a global compilation of soil profiles (USDA NCSS, AfSPDB, ISRIC WISE, EGRPR, SPADE, CanNPDB, UNSODA, SWIG, HYBRAS and HydroS). Data import steps are available here. Spatial prediction steps are described in detail here. Note: these are actually measured and mapped soil content values; no Pedo-Transfer-Functions have been used (except to fill-in the missing NCSS bulk densities). Available water capacity in mm (derived as a difference between field capacity and wilting point multiplied by layer thickness) per layer is available here. Antarctica is not included.",Geology and Soils,"soil available water capacity,soil bulk density,soil water",v0,https://doi.org/10.5281/zenodo.2784001,volumetric percent,Tom Hengl,tom.hengl@opengeohub.org,opengeohub,CC-BY-SA-4.0,,,,250,1950-01-01,2017-12-31,,,static,interval,0,"b0cm,b100cm,b200cm,b30cm,b60cm",https://s3.openlandmap.org/arco//watercontent.33kPa_usda.4b1c_m.sld,https://s3.openlandmap.org/arco/watercontent.33kPa_usda.4b1c_m.qml,https://s3.openlandmap.org/arco/watercontent.33kPa_usda.4b1c_m_250m_{dp}_{dt}_go_epsg.4326_v0.1.tif,,,,,,,,,,,,,,,,,,,,,,,,
