id,ignore,catalog,title,description,Theme,keywords_list,version,doi,layer_unit,contact_name,contact_email,providers_list,license,constellation_list,platform,instruments_list,gsd,start_date,end_date,date_step,date_offset,date_unit,date_style,ignore_29feb,depth_list,sld_url,qml_url,main_url,url_1,url_2,url_3,url_4,url_5,url_6,url_7,url_8,url_9,url_10,url_11,url_12,url_13,url_14,url_15,url_16,url_17,url_18,url_19,url_20,url_21,url_22,url_23,url_24
dsm_glo30,0,openlandmap,Copernius DEM digital surface model,"Global mosaic of 30m Copernicus DEM. The Copernicus DEM is a Digital Surface Model (DSM) that represents the surface of the Earth including buildings, infrastructure and vegetation. Data were acquired through the TanDEM-X mission between 2011 and 2015. ",Elevation and Depth,"glo30,dsm",v20211004,https://doi.org/10.5270/ESA-c5d3d65,meter,Yu-Feng Ho,yu-feng.ho@opengeohub.org,"copernicus,opengeohub",CC-BY-4.0,,tandem-x,"eea-10,glo-30,glo-90",30,2011-01-01,2015-12-31,,,static,interval,0,,https://s3.openlandmap.org/arco/dsm_glo30_m.sld,https://s3.openlandmap.org/arco/dsm_glo30_m.qml,https://s3.openlandmap.org/arco/dsm_glo30_m_30m_s_20110101_20151231_go.epsg.4326_v20211004.tif,,,,,,,,,,,,,,,,,,,,,,,,
lc_glad.glcluc,0,openlandmap,UMD GLAD annual land cover and land use (GLCLUC),"The global 30-m spatial resolution dataset quantifies changes in forest extent and height, cropland, built-up lands, surface water, and perennial snow and ice extent from the year 2000 to 2020. Landsat Analysis Ready Data served as an input for land cover and use mapping. Each thematic product was independently derived using locally and regionally calibrated machine learning tools.",Land Cover and Land Use,"land cover,land use,landsat,forest,cropland,urbanization,snow cover,surface water",v20230901,https://doi.org/10.3389/frsen.2022.856903,class,"
Peter Potapov",potapov@umd.edu,"umd_glad,opengeohub",CC-BY-4.0,,landsat,,30,2000-01-01,2020-12-31,1,4,years,interval,0,,https://s3.openlandmap.org/arco/lc_glad.glcluc_c.sld,https://s3.openlandmap.org/arco/lc_glad.glcluc_c.qml,https://s3.openlandmap.org/arco/lc_glad.glcluc_c_30m_s_{dt}_go_epsg.4326_v20230901.tif,,,,,,,,,,,,,,,,,,,,,,,,
lc_glad.glcluc.change,0,openlandmap,UMD GLAD annual land cover and land use change (GLCLUC),"The global 30-m spatial resolution dataset quantifies changes in forest extent and height, cropland, built-up lands, surface water, and perennial snow and ice extent from the year 2000 to 2020. Landsat Analysis Ready Data served as an input for land cover and use mapping. Each thematic product was independently derived using locally and regionally calibrated machine learning tools.",Land Cover and Land Use,"land cover,land use,landsat,forest,cropland,urbanization,snow cover,surface water",v20230901,https://doi.org/10.3389/frsen.2022.856903,change class,"
Peter Potapov",potapov@umd.edu,"umd_glad,opengeohub",CC-BY-4.0,,landsat,,30,2000-01-01,2020-12-31,,,static,interval,0,,https://s3.openlandmap.org/arco/lc_glad.glcluc_c.sld,https://s3.openlandmap.org/arco/lc_glad.glcluc_c.qml,https://s3.openlandmap.org/arco/lc_glad.glcluc.change_c_30m_s_{dt}_go_epsg.4326_v20230901.tif,,,,,,,,,,,,,,,,,,,,,,,,
landuse.cropland_hyde,0,openlandmap,HYDE annual cropland for the holocene,History Database of the Global Environment (HYDE version 3.2). HYDE is an internally consistent combination of historical population estimates and allocation algorithms with time-dependent weighting maps for land use.,Land Cover and Land Use,"historical population,land use,cropland,pasture,holocene,agriculture",v3,https://doi.org/10.17026/dans-25g-gez3,index,Kees Klein Goldewijk,c.g.m.kleingoldewijk@uu.nl,"dans_arch,opengeohub",CC0 1.0,,,,10000,1700-01-01,2016-12-31,1,"9,9,9,9,9,9,9,9,9,9,9,9,9,9,9,9,9,9,9,9,9,9,9,9,9,9,9,9,9,9,0,0,0,0,0,0,0,0,0,0,0,0,0,0,0,0,0",years,interval,0,,https://s3.openlandmap.org/arco/hyde.cropland.sld,https://s3.openlandmap.org/arco/hyde.cropland.qml,https://s3.openlandmap.org/arco/landuse.cropland_hyde_p_10km_s_{dt}_go_epsg.4326_v3.2.tif,,,,,,,,,,,,,,,,,,,,,,,,
landuse.pasture_hyde,0,openlandmap,HYDE annual pasture for the holocene,History Database of the Global Environment (HYDE version 3.2). HYDE is an internally consistent combination of historical population estimates and allocation algorithms with time-dependent weighting maps for land use.,Land Cover and Land Use,"historical population,land use,cropland,pasture,holocene,agriculture",v3,https://doi.org/10.17026/dans-25g-gez3,index,Kees Klein Goldewijk,c.g.m.kleingoldewijk@uu.nl,"dans_arch,opengeohub",CC0 1.0,,,,10000,1700-01-01,2016-12-31,1,"9,9,9,9,9,9,9,9,9,9,9,9,9,9,9,9,9,9,9,9,9,9,9,9,9,9,9,9,9,9,0,0,0,0,0,0,0,0,0,0,0,0,0,0,0,0,0",years,interval,0,,https://s3.openlandmap.org/arco/hyde.cropland.sld,https://s3.openlandmap.org/arco/hyde.cropland.qml,https://s3.openlandmap.org/arco/landuse.pasture_hyde_p_10km_s_{dt}_go_epsg.4326_v3.2.tif,,,,,,,,,,,,,,,,,,,,,,,,
land.use.land.cover_hilda.plus,0,openlandmap,HILDA+ annual land use and land cover change,"HILDA+ (HIstoric Land Dynamics Assessment+) global dataset indicates annual land use/cover change between 1960-2019 at 1 km spatial resolution. It integrates multiple open data streams (from high-resolution remote sensing, long-term land use reconstructions and statistics). It covers six generic land use/cover categories: 1: Urban areas, 2: Cropland, 3: Pasture/rangeland, 4: Forest, 5: Unmanaged grass/shrubland, 6: Sparse/no vegetation.",Land Cover and Land Use,"land cover,land use,land use change,remote sensing",v1,https://doi.org/10.1594/PANGAEA.921846,class,Karina Winkler,karina.winkler@kit.edu,"kit_meteo,opengeohub",CC-BY-4.0,,,,1000,1960-01-01,2019-12-31,1,,years,interval,0,,https://s3.openlandmap.org/arco/land.use.land.cover_hilda.plus.sld,https://s3.openlandmap.org/arco/land.use.land.cover_hilda.plus.qml,https://s3.openlandmap.org/arco/land.use.land.cover_hilda.plus_c_1km_s_{dt}_go_espg.4326_v1.0.tif,,,,,,,,,,,,,,,,,,,,,,,,
lst_mod11a2.daytime.trend.logit.ols.beta,0,openlandmap,MOD11A2 long-term land surface temperature trend (daytime),"Long-term trend analysis of MOD11A2 monthly LST day-time temperatures. Trend was produced by fitting regression models to de-seasonalized time-series. Models are fitted for each pixel and several long-term temporal metrics (alpha, beta, P>|t|, rsqr) has been derived.",Climate,"modis,land surface temperature,trend",v1,https://doi.org/10.5281/zenodo.1420114,slope (ols),Leandro Parente,leandro.parente@opengeohub.org,"lp_daac,opengeohub",CC-BY-SA-4.0,,,modis,1000,2000-01-01,2021-12-31,,,static,interval,1,,https://s3.openlandmap.org/arco/lst_mod11a2.trend.logit.ols.beta_day.sld,https://s3.openlandmap.org/arco/lst_mod11a2.trend.logit.ols.beta_day.qml,https://s3.openlandmap.org/arco/lst_mod11a2.daytime.trend.logit.ols.beta_m_1km_s_{dt}_go_epsg.4326_v1.2.tif,https://s3.openlandmap.org/arco/lst_mod11a2.daytime.trend.logit.ols.beta_p025_1km_s_{dt}_go_epsg.4326_v1.2.tif,https://s3.openlandmap.org/arco/lst_mod11a2.daytime.trend.logit.ols.beta_p975_1km_s_{dt}_go_epsg.4326_v1.2.tif,https://s3.openlandmap.org/arco/lst_mod11a2.daytime.trend.logit.ols.beta_pv_1km_s_{dt}_go_epsg.4326_v1.2.tif,https://s3.openlandmap.org/arco/lst_mod11a2.daytime.trend.logit.ols.beta_sd_1km_s_{dt}_go_epsg.4326_v1.2.tif,https://s3.openlandmap.org/arco/lst_mod11a2.daytime.trend.logit.ols.beta_tv_1km_s_{dt}_go_epsg.4326_v1.2.tif,https://s3.openlandmap.org/arco/lst_mod11a2.daytime.trend.logit.ols.alpha_m_1km_s_{dt}_go_epsg.4326_v1.2.tif,https://s3.openlandmap.org/arco/lst_mod11a2.daytime.trend.logit.ols.alpha_p025_1km_s_{dt}_go_epsg.4326_v1.2.tif,https://s3.openlandmap.org/arco/lst_mod11a2.daytime.trend.logit.ols.alpha_p975_1km_s_{dt}_go_epsg.4326_v1.2.tif,https://s3.openlandmap.org/arco/lst_mod11a2.daytime.trend.logit.ols.alpha_pv_1km_s_{dt}_go_epsg.4326_v1.2.tif,https://s3.openlandmap.org/arco/lst_mod11a2.daytime.trend.logit.ols.alpha_sd_1km_s_{dt}_go_epsg.4326_v1.2.tif,https://s3.openlandmap.org/arco/lst_mod11a2.daytime.trend.logit.ols.alpha_tv_1km_s_{dt}_go_epsg.4326_v1.2.tif,https://s3.openlandmap.org/arco/lst_mod11a2.daytime.trend.logit.ols_r2_1km_s_{dt}_go_epsg.4326_v1.2.tif,,,,,,,,,,,,
lst_mod11a2.nighttime.trend.logit.ols.beta,0,openlandmap,MOD11A2 long-term land surface temperature trend (nighttime),"Long-term trend analysis of MOD11A2 monthly LST night-time temperatures. Trend was produced by fitting regression models to de-seasonalized time-series. Models are fitted for each pixel and several long-term temporal metrics (alpha, beta, P>|t|, rsqr) has been derived.",Climate,"modis,land surface temperature,trend",v1,https://doi.org/10.5281/zenodo.1420114,slope (ols),Leandro Parente,leandro.parente@opengeohub.org,"lp_daac,opengeohub",CC-BY-SA-4.0,,,modis,1000,2000-01-01,2021-12-31,,,static,interval,1,,https://s3.openlandmap.org/arco/lst_mod11a2.trend.logit.ols.beta_night.sld,https://s3.openlandmap.org/arco/lst_mod11a2.trend.logit.ols.beta_night.qml,https://s3.openlandmap.org/arco/lst_mod11a2.nighttime.trend.logit.ols.beta_m_1km_s_{dt}_go_epsg.4326_v1.2.tif,https://s3.openlandmap.org/arco/lst_mod11a2.nighttime.trend.logit.ols.beta_p025_1km_s_{dt}_go_epsg.4326_v1.2.tif,https://s3.openlandmap.org/arco/lst_mod11a2.nighttime.trend.logit.ols.beta_p975_1km_s_{dt}_go_epsg.4326_v1.2.tif,https://s3.openlandmap.org/arco/lst_mod11a2.nighttime.trend.logit.ols.beta_pv_1km_s_{dt}_go_epsg.4326_v1.2.tif,https://s3.openlandmap.org/arco/lst_mod11a2.nighttime.trend.logit.ols.beta_sd_1km_s_{dt}_go_epsg.4326_v1.2.tif,https://s3.openlandmap.org/arco/lst_mod11a2.nighttime.trend.logit.ols.beta_tv_1km_s_{dt}_go_epsg.4326_v1.2.tif,https://s3.openlandmap.org/arco/lst_mod11a2.nighttime.trend.logit.ols.alpha_m_1km_s_{dt}_go_epsg.4326_v1.2.tif,https://s3.openlandmap.org/arco/lst_mod11a2.nighttime.trend.logit.ols.alpha_p025_1km_s_{dt}_go_epsg.4326_v1.2.tif,https://s3.openlandmap.org/arco/lst_mod11a2.nighttime.trend.logit.ols.alpha_p975_1km_s_{dt}_go_epsg.4326_v1.2.tif,https://s3.openlandmap.org/arco/lst_mod11a2.nighttime.trend.logit.ols.alpha_pv_1km_s_{dt}_go_epsg.4326_v1.2.tif,https://s3.openlandmap.org/arco/lst_mod11a2.nighttime.trend.logit.ols.alpha_sd_1km_s_{dt}_go_epsg.4326_v1.2.tif,https://s3.openlandmap.org/arco/lst_mod11a2.nighttime.trend.logit.ols.alpha_tv_1km_s_{dt}_go_epsg.4326_v1.2.tif,https://s3.openlandmap.org/arco/lst_mod11a2.nighttime.trend.logit.ols_r2_1km_s_{dt}_go_epsg.4326_v1.2.tif,,,,,,,,,,,,
lst_mod11a2.daytime.annual,0,openlandmap,MOD11A2 annual land surface temperature (day-time),"Day-time land surface temperature, derived from MOD11A2, yearly aggregated considering three percentiles (p05, p50 and p95) and standard deviation of cloud-free pixels. All months were gapfilled by TMWM, which uses cloud-free pixel values from diferent periods to interpolate the missing values.",Climate,"modis,land surface temperature,monthly",v1,https://doi.org/10.5281/zenodo.1420114,K,Leandro Parente,leandro.parente@opengeohub.org,"lp_daac,opengeohub",CC-BY-SA-4.0,,,modis,1000,2000-01-01,2021-12-31,1,,years,interval,1,,https://s3.openlandmap.org/arco/lst_mod11a2_m.sld,https://s3.openlandmap.org/arco/lst_mod11a2_m.qml,https://s3.openlandmap.org/arco/lst_mod11a2.daytime_p50_1km_s_{dt}_go_epsg.4326_v1.2.tif,https://s3.openlandmap.org/arco/lst_mod11a2.daytime_p05_1km_s_{dt}_go_epsg.4326_v1.2.tif,https://s3.openlandmap.org/arco/lst_mod11a2.daytime_p95_1km_s_{dt}_go_epsg.4326_v1.2.tif,https://s3.openlandmap.org/arco/lst_mod11a2.daytime_sd_1km_s_{dt}_go_epsg.4326_v1.2.tif,,,,,,,,,,,,,,,,,,,,,
lst_mod11a2.nighttime.annual,0,openlandmap,MOD11A2 annual land surface temperature (night-time),"Night-time land surface temperature, derived from MOD11A2, yearly aggregated considering three percentiles (p05, p50 and p95) and standard deviation of cloud-free pixels. All months were gapfilled by TMWM, which uses cloud-free pixel values from diferent periods to interpolate the missing values.",Climate,"modis,land surface temperature,monthly",v1,https://doi.org/10.5281/zenodo.1420114,K,Leandro Parente,leandro.parente@opengeohub.org,"lp_daac,opengeohub",CC-BY-SA-4.0,,,modis,1000,2000-01-01,2021-12-31,1,,years,interval,1,,https://s3.openlandmap.org/arco/lst_mod11a2_m.sld,https://s3.openlandmap.org/arco/lst_mod11a2_m.qml,https://s3.openlandmap.org/arco/lst_mod11a2.nighttime_p50_1km_s_{dt}_go_epsg.4326_v1.2.tif,https://s3.openlandmap.org/arco/lst_mod11a2.nighttime_p05_1km_s_{dt}_go_epsg.4326_v1.2.tif,https://s3.openlandmap.org/arco/lst_mod11a2.nighttime_p95_1km_s_{dt}_go_epsg.4326_v1.2.tif,https://s3.openlandmap.org/arco/lst_mod11a2.nighttime_sd_1km_s_{dt}_go_epsg.4326_v1.2.tif,,,,,,,,,,,,,,,,,,,,,
lst_mod11a2.daytime,0,openlandmap,MOD11A2 monthly land surface temperature (day-time),"Day-time land surface temperature, derived from MOD11A2, monthly aggregated considering three percentiles (p05, p50 and p95) and standard deviation of cloud-free pixels. All months were gapfilled by TMWM, which uses cloud-free pixel values from diferent periods to interpolate the missing values.",Climate,"modis,land surface temperature,monthly",v1,https://doi.org/10.5281/zenodo.1420114,K,Leandro Parente,leandro.parente@opengeohub.org,"lp_daac,opengeohub",CC-BY-SA-4.0,,,modis,1000,2000-01-01,2021-12-31,1,,months,interval,1,,https://s3.openlandmap.org/arco/lst_mod11a2_m.sld,https://s3.openlandmap.org/arco/lst_mod11a2_m.qml,https://s3.openlandmap.org/arco/lst_mod11a2.daytime_p50_1km_s_{dt}_go_epsg.4326_v1.2.tif,https://s3.openlandmap.org/arco/lst_mod11a2.daytime_p05_1km_s_{dt}_go_epsg.4326_v1.2.tif,https://s3.openlandmap.org/arco/lst_mod11a2.daytime_p95_1km_s_{dt}_go_epsg.4326_v1.2.tif,https://s3.openlandmap.org/arco/lst_mod11a2.daytime_sd_1km_s_{dt}_go_epsg.4326_v1.2.tif,,,,,,,,,,,,,,,,,,,,,
lst_mod11a2.nighttime,0,openlandmap,MOD11A2 monthly land surface temperature (night-time),"Night-time land surface temperature, derived from MOD11A2, monthly aggregated considering three percentiles (p05, p50 and p95) and standard deviation of cloud-free pixels. All months were gapfilled by TMWM, which uses cloud-free pixel values from diferent periods to interpolate the missing values.",Climate,"modis,land surface temperature,monthly",v1,https://doi.org/10.5281/zenodo.1420114,K,Leandro Parente,leandro.parente@opengeohub.org,"lp_daac,opengeohub",CC-BY-SA-4.0,,,modis,1000,2000-01-01,2021-12-31,1,,months,interval,1,,https://s3.openlandmap.org/arco/lst_mod11a2_m.sld,https://s3.openlandmap.org/arco/lst_mod11a2_m.qml,https://s3.openlandmap.org/arco/lst_mod11a2.nighttime_p50_1km_s_{dt}_go_epsg.4326_v1.2.tif,https://s3.openlandmap.org/arco/lst_mod11a2.nighttime_p05_1km_s_{dt}_go_epsg.4326_v1.2.tif,https://s3.openlandmap.org/arco/lst_mod11a2.nighttime_p95_1km_s_{dt}_go_epsg.4326_v1.2.tif,https://s3.openlandmap.org/arco/lst_mod11a2.nighttime_sd_1km_s_{dt}_go_epsg.4326_v1.2.tif,,,,,,,,,,,,,,,,,,,,,
landform_usgs.ecotapestry,0,openlandmap,OpenLandMap landform classes,"Layers include: landform (7) indicator maps (0-100%). Derived from the USGS Global Ecosystem Map, i.e. the EcoTapestry map. Water bodies masked out. Antarctica is not included.",Geology and Soils,"landform,terrain",v1,https://doi.org/10.5281/zenodo.1464846,,Tom Hengl,tom.hengl@opengeohub.org,opengeohub,CC-BY-SA-4.0,,,,250,2014-01-01,2014-12-31,,,static,interval,0,,https://s3.openlandmap.org/arco/landform_usgs.ecotapestry_c.sld,https://s3.openlandmap.org/arco/landform_usgs.ecotapestry_c.qml,https://s3.openlandmap.org/arco/landform_usgs.ecotapestry_c_250m_s_{dt}_go_epsg.4326_v1.0.tif,,,,,,,,,,,,,,,,,,,,,,,,
lithology_usgs.ecotapestry,0,openlandmap,OpenLandMap lithology classes,"Layers include: lithology (15) indicator maps (0-100%). Derived from the USGS Global Ecosystem Map, i.e. the EcoTapestry map. Water bodies masked out. Antarctica is not included.",Geology and Soils,"lithology,terrain",v1,https://doi.org/10.5281/zenodo.1464846,,Tom Hengl,tom.hengl@opengeohub.org,opengeohub,CC-BY-SA-4.0,,,,250,2014-01-01,2014-12-31,,,static,interval,0,,https://s3.openlandmap.org/arco/lithology_usgs.ecotapestry_c.sld,https://s3.openlandmap.org/arco/lithology_usgs.ecotapestry_c.qml,https://s3.openlandmap.org/arco/lithology_usgs.ecotapestry_c_250m_s_{dt}_go_epsg.4326_v1.0.tif,,,,,,,,,,,,,,,,,,,,,,,,
grtgroup_usda.soiltax.hapludalfs,0,openlandmap,OpenLandMap Haopludalfs of USDA soil great groups,"Distribution of hapludalfs ofthe USDA soil great groups based on machine learning predictions from global compilation of soil profiles (>350,000 training points).",Geology and Soils,"soil type,usda soil taxonomy,.haplustalfs",v0,https://doi.org/10.5281/zenodo.3528062,,Tom Hengl,tom.hengl@opengeohub.org,opengeohub,CC-BY-SA-4.0,,,,250,1950-01-01,2017-12-31,,,static,interval,0,,https://s3.openlandmap.org/arco/grtgroup_usda.soiltax.hapludalf.sld,https://s3.openlandmap.org/arco/grtgroup_usda.soiltax.hapludalf.qml,https://s3.openlandmap.org/arco/grtgroup_usda.soiltax.hapludalfs_p_250m_s_{dt}_go_epsg.4326_v0.2.tif,,,,,,,,,,,,,,,,,,,,,,,,
biome.type_biome00k,0,openlandmap,Potential distribution of biomes,Potential distribution of biomes (Potential Natural Vegetation) at 250 m spatial resolution based on the BIOME 6000 data set (8057 modern pollen-based site reconstructions). Predicted at 250 m using Ensemble Machine Learning and relief and climate variables representing the climate for the last 20+ years.,Biodiversity and Nature Conservation,"potential natural vegetation,biome",v0,https://doi.org/10.5281/zenodo.3526620,class,Tom Hengl,tom.hengl@opengeohub.org,opengeohub,CC-BY-SA-4.0,,,,250,2000-01-01,2017-12-31,,,static,interval,0,,https://s3.openlandmap.org/arco/biome.type_biome00k_c.sld,https://s3.openlandmap.org/arco/biome.type_biome00k_c.qml,https://s3.openlandmap.org/arco/biome.type_biome00k_c_250m_s_{dt}_go_epsg.4326_v0.2.tif,https://s3.openlandmap.org/arco/biome.type_biome00k_c_1km_s_{dt}_go_epsg.4326_v0.2.tif,,,,,,,,,,,,,,,,,,,,,,,
biomes_biome6k.tropical.evergreen.broadleaf.forest,0,openlandmap,Potential distribution of tropical evergreen broadleaf forest,Probability and uncertainty maps showing the potential current natural vegetation (tropical evergreen broadleaf forest) on a global scale. Current (2022 - 2023) conditions are calculated on historical long term averages (1979 - 2013),Biodiversity and Nature Conservation,"eml,biomes",v20230410,https://doi.org/10.5281/zenodo.7822868,probability,"Bonannella, Carmelo",carmelo.bonannella@opengeohub.org,opengeohub,CC-BY-4.0,,,,1000,1979-01-01,2013-12-31,,,static,interval,0,,https://s3.openlandmap.org/arco/biome_probability_style.sld,https://s3.openlandmap.org/arco/biome_probability_style.qml,https://s3.openlandmap.org/arco/biomes_biome6k.tropical.evergreen.broadleaf.forest_p_1km_a_{dt}_go_epsg.4326_v20230410.tif,https://s3.openlandmap.org/arco/biomes_biome6k.tropical.evergreen.broadleaf.forest_md_1km_a_{dt}_go_epsg.4326_v20230410.tif,,,,,,,,,,,,,,,,,,,,,,,
biomes_biome6k.tropical.evergreen.broadleaf.forest.rcp26,0,openlandmap,Future potential distribution of tropical evergreen broadleaf forest (RCP 2.6),Probability and uncertainty maps showing the potential future natural vegetation (tropical evergreen broadleaf forest) on a global scale. Future projections (RCP 2.6) cover two different epochs: 2041 - 2060 and 2061 - 2080,Biodiversity and Nature Conservation,"eml,biomes,rcp",v20230410,https://doi.org/10.5281/zenodo.7822868,probability,"Bonannella, Carmelo",carmelo.bonannella@opengeohub.org,opengeohub,CC-BY-4.0,,,,1000,2041-01-01,2080-12-31,20,,years,interval,0,,https://s3.openlandmap.org/arco/biome_probability_style.sld,https://s3.openlandmap.org/arco/biome_probability_style.qml,https://s3.openlandmap.org/arco/biomes_biome6k.tropical.evergreen.broadleaf.forest.rcp26_p_1km_a_{dt}_go_epsg.4326_v20230410.tif,https://s3.openlandmap.org/arco/biomes_biome6k.tropical.evergreen.broadleaf.forest.rcp26_md_1km_a_{dt}_go_epsg.4326_v20230410.tif,,,,,,,,,,,,,,,,,,,,,,,
biomes_biome6k.tropical.evergreen.broadleaf.forest.rcp45,0,openlandmap,Future potential distribution of tropical evergreen broadleaf forest (RCP 4.5),Probability and uncertainty maps showing the potential future natural vegetation (tropical evergreen broadleaf forest) on a global scale. Future projections (RCP 4.5) cover two different epochs: 2041 - 2060 and 2061 - 2080,Biodiversity and Nature Conservation,"eml,biomes,rcp",v20230410,https://doi.org/10.5281/zenodo.7822868,probability,"Bonannella, Carmelo",carmelo.bonannella@opengeohub.org,opengeohub,CC-BY-4.0,,,,1000,2041-01-01,2080-12-31,20,,years,interval,0,,https://s3.openlandmap.org/arco/biome_probability_style.sld,https://s3.openlandmap.org/arco/biome_probability_style.qml,https://s3.openlandmap.org/arco/biomes_biome6k.tropical.evergreen.broadleaf.forest.rcp45_p_1km_a_{dt}_go_epsg.4326_v20230410.tif,https://s3.openlandmap.org/arco/biomes_biome6k.tropical.evergreen.broadleaf.forest.rcp45_md_1km_a_{dt}_go_epsg.4326_v20230410.tif,,,,,,,,,,,,,,,,,,,,,,,
biomes_biome6k.tropical.evergreen.broadleaf.forest.rcp85,0,openlandmap,Future potential distribution of tropical evergreen broadleaf forest (RCP 8.5),Probability and uncertainty maps showing the potential future natural vegetation (tropical evergreen broadleaf forest) on a global scale. Future projections (RCP 8.5) cover two different epochs: 2041 - 2060 and 2061 - 2080,Biodiversity and Nature Conservation,"eml,biomes,rcp",v20230410,https://doi.org/10.5281/zenodo.7822868,probability,"Bonannella, Carmelo",carmelo.bonannella@opengeohub.org,opengeohub,CC-BY-4.0,,,,1000,2041-01-01,2080-12-31,20,,years,interval,0,,https://s3.openlandmap.org/arco/biome_probability_style.sld,https://s3.openlandmap.org/arco/biome_probability_style.qml,https://s3.openlandmap.org/arco/biomes_biome6k.tropical.evergreen.broadleaf.forest.rcp85_p_1km_a_{dt}_go_epsg.4326_v20230410.tif,https://s3.openlandmap.org/arco/biomes_biome6k.tropical.evergreen.broadleaf.forest.rcp85_md_1km_a_{dt}_go_epsg.4326_v20230410.tif,,,,,,,,,,,,,,,,,,,,,,,
biomes_biome6k.tropical.savanna,0,openlandmap,Potential distribution of tropical savanna,Probability and uncertainty maps showing the potential current natural vegetation (tropical savanna) on a global scale. Current (2022 - 2023) conditions are calculated on historical long term averages (1979 - 2013),Biodiversity and Nature Conservation,"eml,biomes",v20230410,https://doi.org/10.5281/zenodo.7822868,probability,"Bonannella, Carmelo",carmelo.bonannella@opengeohub.org,opengeohub,CC-BY-4.0,,,,1000,1979-01-01,2013-12-31,,,static,interval,0,,https://s3.openlandmap.org/arco/biome_probability_style.sld,https://s3.openlandmap.org/arco/biome_probability_style.qml,https://s3.openlandmap.org/arco/biomes_biome6k.tropical.savanna_p_1km_a_{dt}_go_epsg.4326_v20230410.tif,https://s3.openlandmap.org/arco/biomes_biome6k.tropical.savanna_md_1km_a_{dt}_go_epsg.4326_v20230410.tif,,,,,,,,,,,,,,,,,,,,,,,
biomes_biome6k.tropical.savanna.rcp26,0,openlandmap,Future potential distribution of tropical savanna (RCP 2.6),Probability and uncertainty maps showing the potential future natural vegetation (tropical savanna) on a global scale. Future projections (RCP 2.6) cover two different epochs: 2041 - 2060 and 2061 - 2080,Biodiversity and Nature Conservation,"eml,biomes,rcp",v20230410,https://doi.org/10.5281/zenodo.7822868,probability,"Bonannella, Carmelo",carmelo.bonannella@opengeohub.org,opengeohub,CC-BY-4.0,,,,1000,2041-01-01,2080-12-31,20,,years,interval,0,,https://s3.openlandmap.org/arco/biome_probability_style.sld,https://s3.openlandmap.org/arco/biome_probability_style.qml,https://s3.openlandmap.org/arco/biomes_biome6k.tropical.savanna.rcp26_p_1km_a_{dt}_go_epsg.4326_v20230410.tif,https://s3.openlandmap.org/arco/biomes_biome6k.tropical.savanna.rcp26_md_1km_a_{dt}_go_epsg.4326_v20230410.tif,,,,,,,,,,,,,,,,,,,,,,,
biomes_biome6k.tropical.savanna.rcp45,0,openlandmap,Future potential distribution of tropical savanna (RCP 4.5),Probability and uncertainty maps showing the potential future natural vegetation (tropical savanna) on a global scale. Future projections (RCP 4.5) cover two different epochs: 2041 - 2060 and 2061 - 2080,Biodiversity and Nature Conservation,"eml,biomes,rcp",v20230410,https://doi.org/10.5281/zenodo.7822868,probability,"Bonannella, Carmelo",carmelo.bonannella@opengeohub.org,opengeohub,CC-BY-4.0,,,,1000,2041-01-01,2080-12-31,20,,years,interval,0,,https://s3.openlandmap.org/arco/biome_probability_style.sld,https://s3.openlandmap.org/arco/biome_probability_style.qml,https://s3.openlandmap.org/arco/biomes_biome6k.tropical.savanna.rcp45_p_1km_a_{dt}_go_epsg.4326_v20230410.tif,https://s3.openlandmap.org/arco/biomes_biome6k.tropical.savanna.rcp45_md_1km_a_{dt}_go_epsg.4326_v20230410.tif,,,,,,,,,,,,,,,,,,,,,,,
biomes_biome6k.tropical.savanna.rcp85,0,openlandmap,Future potential distribution of tropical savanna (RCP 8.5),Probability and uncertainty maps showing the potential future natural vegetation (tropical savanna) on a global scale. Future projections (RCP 8.5) cover two different epochs: 2041 - 2060 and 2061 - 2080,Biodiversity and Nature Conservation,"eml,biomes,rcp",v20230410,https://doi.org/10.5281/zenodo.7822868,probability,"Bonannella, Carmelo",carmelo.bonannella@opengeohub.org,opengeohub,CC-BY-4.0,,,,1000,2041-01-01,2080-12-31,20,,years,interval,0,,https://s3.openlandmap.org/arco/biome_probability_style.sld,https://s3.openlandmap.org/arco/biome_probability_style.qml,https://s3.openlandmap.org/arco/biomes_biome6k.tropical.savanna.rcp85_p_1km_a_{dt}_go_epsg.4326_v20230410.tif,https://s3.openlandmap.org/arco/biomes_biome6k.tropical.savanna.rcp85_md_1km_a_{dt}_go_epsg.4326_v20230410.tif,,,,,,,,,,,,,,,,,,,,,,,
